<!ELEMENT partidos (partido+)>
<!ELEMENT partido (equipo_local,equipo_visitante)>
<!ELEMENT equipo_local (nombre,goles)>
<!ELEMENT equipo_visitante (nombre,goles)>
<!ELEMENT nombre (#PCDATA)>
<!ELEMENT goles (#PCDATA)>